[
  {
    "area": "Crateria",
    "subarea": "West",
    "id": 20,
    "connections": [
      {
        "id": 1,
        "to": {
          "area": "Crateria",
          "subarea": "West",
          "id": 21
        }
      },
      {
        "id": 2,
        "to": {
          "area": "Crateria",
          "subarea": "Central",
          "id": 10
        }
      }
    ]
  },
  {
    "area": "Crateria",
    "subarea": "West",
    "id": 21,
    "connections": [
      {
        "id": 1,
        "to": {
          "area": "Crateria",
          "subarea": "West",
          "id": 22
        }
      },
      {
        "id": 2,
        "to": {
          "area": "Crateria",
          "subarea": "West",
          "id": 31
        }
      },
      {
        "id": 3,
        "to": {
          "area": "Crateria",
          "subarea": "West",
          "id": 20
        }
      },
      {
        "id": 4,
        "to": {
          "area": "Crateria",
          "subarea": "West",
          "id": 26
        }
      }
    ]
  },
  {
    "area": "Crateria",
    "subarea": "West",
    "id": 22,
    "connections": [
      {
        "id": 1,
        "to": {
          "area": "Crateria",
          "subarea": "West",
          "id": 23
        }
      },
      {
        "id": 2,
        "to": {
          "area": "Crateria",
          "subarea": "West",
          "id": 21
        }
      }
    ]
  },
  {
    "area": "Crateria",
    "subarea": "West",
    "id": 23,
    "connections": [
      {
        "id": 1,
        "to": {
          "area": "Brinstar",
          "subarea": "Green",
          "id": 44
        }
      },
      {
        "id": 2,
        "to": {
          "area": "Crateria",
          "subarea": "West",
          "id": 22
        }
      }
    ]
  },
  {
    "area": "Crateria",
    "subarea": "West",
    "id": 24,
    "connections": [
      {
        "id": 1,
        "to": {
          "area": "Crateria",
          "subarea": "Central",
          "id": 9
        }
      },
      {
        "id": 2,
        "to": {
          "area": "Crateria",
          "subarea": "East",
          "id": 7
        }
      }
    ]
  },
  {
    "area": "Crateria",
    "subarea": "West",
    "id": 25,
    "connections": [
      {
        "id": 1,
        "to": {
          "area": "Crateria",
          "subarea": "West",
          "id": 24
        }
      },
      {
        "id": 2,
        "to": {
          "area": "Brinstar",
          "subarea": "Red",
          "id": 75
        }
      }
    ]
  },
  {
    "area": "Crateria",
    "subarea": "West",
    "id": 26,
    "connections": [
      {
        "id": 1,
        "to": {
          "area": "Crateria",
          "subarea": "West",
          "id": 25
        }
      },
      {
        "id": 2,
        "to": {
          "area": "Crateria",
          "subarea": "West",
          "id": 27
        }
      }
    ]
  },
  {
    "area": "Crateria",
    "subarea": "West",
    "id": 27,
    "connections": [
      {
        "id": 1,
        "to": {
          "area": "Crateria",
          "subarea": "West",
          "id": 26
        }
      },
      {
        "id": 2,
        "to": {
          "area": "Tourian",
          "subarea": "Main",
          "id": 224
        }
      }
    ]
  },
  {
    "area": "Crateria",
    "subarea": "West",
    "id": 30,
    "connections": [
      {
        "id": 1,
        "to": {
          "area": "Crateria",
          "subarea": "West",
          "id": 31
        }
      },
      {
        "id": 2,
        "to": {
          "area": "Crateria",
          "subarea": "Central",
          "id": 8
        }
      }
    ]
  },
  {
    "area": "Crateria",
    "subarea": "West",
    "id": 31,
    "connections": [
      {
        "id": 1,
        "to": {
          "area": "Crateria",
          "subarea": "West",
          "id": 21
        }
      },
      {
        "id": 2,
        "to": {
          "area": "Crateria",
          "subarea": "West",
          "id": 30
        }
      }
    ]
  }
]
