[
  {
    "area": "Ceres Station",
    "subarea": "Ceres Station",
    "id": 1,
    "connections": [
      {
        "id": 2,
        "to": {
          "area": "Ceres Station",
          "subarea": "Ceres Station",
          "id": 2,
          "note": "Room ID that this node within this Room connects to"
        },
        "note": "Node ID of node within Room ID"
      }
    ],
    "note": "Room ID"
  },
  {
    "area": "Ceres Station",
    "subarea": "Ceres Station",
    "id": 2,
    "connections": [
      {
        "id": 1,
        "to": {
          "area": "Ceres Station",
          "subarea": "Ceres Station",
          "id": 1
        }
      },
      {
        "id": 2,
        "to": {
          "area": "Ceres Station",
          "subarea": "Ceres Station",
          "id": 3
        }
      }
    ]
  },
  {
    "area": "Ceres Station",
    "subarea": "Ceres Station",
    "id": 3,
    "connections": [
      {
        "id": 1,
        "to": {
          "area": "Ceres Station",
          "subarea": "Ceres Station",
          "id": 2
        }
      },
      {
        "id": 2,
        "to": {
          "area": "Ceres Station",
          "subarea": "Ceres Station",
          "id": 4
        }
      }
    ]
  },
  {
    "area": "Ceres Station",
    "subarea": "Ceres Station",
    "id": 4,
    "connections": [
      {
        "id": 1,
        "to": {
          "area": "Ceres Station",
          "subarea": "Ceres Station",
          "id": 3
        }
      },
      {
        "id": 2,
        "to": {
          "area": "Ceres Station",
          "subarea": "Ceres Station",
          "id": 5
        }
      }
    ]
  },
  {
    "area": "Ceres Station",
    "subarea": "Ceres Station",
    "id": 5,
    "connections": [
      {
        "id": 1,
        "to": {
          "area": "Ceres Station",
          "subarea": "Ceres Station",
          "id": 4
        }
      },
      {
        "id": 2,
        "to": {
          "area": "Ceres Station",
          "subarea": "Ceres Station",
          "id": 6
        }
      }
    ]
  },
  {
    "area": "Ceres Station",
    "subarea": "Ceres Station",
    "id": 6,
    "connections": [
      {
        "id": 1,
        "to": {
          "area": "Ceres Station",
          "subarea": "Ceres Station",
          "id": 5
        }
      }
    ]
  }
]
