[
  {
    "area": "Crateria",
    "subarea": "Central",
    "id": 8,
    "connections": [
      {
        "id": 1,
        "to": {
          "area": "Crateria",
          "subarea": "West",
          "id": 30
        }
      },
      {
        "id": 2,
        "to": {
          "area": "Crateria",
          "subarea": "Central",
          "id": 10
        }
      },
      {
        "id": 3,
        "to": {
          "area": "Crateria",
          "subarea": "Central",
          "id": 9
        }
      },
      {
        "id": 4,
        "to": {
          "area": "Crateria",
          "subarea": "Central",
          "id": 28
        }
      }
    ]
  },
  {
    "area": "Crateria",
    "subarea": "Central",
    "id": 9,
    "connections": [
      {
        "id": 1,
        "to": {
          "area": "Crateria",
          "subarea": "Central",
          "id": 8
        }
      },
      {
        "id": 2,
        "to": {
          "area": "Crateria",
          "subarea": "West",
          "id": 24
        }
      }
    ]
  },
  {
    "area": "Crateria",
    "subarea": "Central",
    "id": 10,
    "connections": [
      {
        "id": 1,
        "to": {
          "area": "Crateria",
          "subarea": "West",
          "id": 20
        }
      },
      {
        "id": 2,
        "to": {
          "area": "Crateria",
          "subarea": "Central",
          "id": 16
        }
      },
      {
        "id": 3,
        "to": {
          "area": "Crateria",
          "subarea": "Central",
          "id": 18
        }
      },
      {
        "id": 4,
        "to": {
          "area": "Crateria",
          "subarea": "Central",
          "id": 11
        }
      },
      {
        "id": 5,
        "to": {
          "area": "Crateria",
          "subarea": "Central",
          "id": 14
        }
      },
      {
        "id": 6,
        "to": {
          "area": "Crateria",
          "subarea": "Central",
          "id": 13
        }
      },
      {
        "id": 7,
        "to": {
          "area": "Crateria",
          "subarea": "Central",
          "id": 8
        }
      }
    ]
  },
  {
    "area": "Crateria",
    "subarea": "Central",
    "id": 11,
    "connections": [
      {
        "id": 1,
        "to": {
          "area": "Tourian",
          "subarea": "Main",
          "id": 242
        }
      },
      {
        "id": 2,
        "to": {
          "area": "Crateria",
          "subarea": "Central",
          "id": 12
        }
      },
      {
        "id": 3,
        "to": {
          "area": "Crateria",
          "subarea": "Central",
          "id": 29
        }
      },
      {
        "id": 4,
        "to": {
          "area": "Crateria",
          "subarea": "Central",
          "id": 29
        }
      },
      {
        "id": 5,
        "to": {
          "area": "Crateria",
          "subarea": "Central",
          "id": 10
        }
      }
    ]
  },
  {
    "area": "Crateria",
    "subarea": "Central",
    "id": 12,
    "connections": [
      {
        "id": 1,
        "to": {
          "area": "Crateria",
          "subarea": "Central",
          "id": 11
        }
      },
      {
        "id": 2,
        "to": {
          "area": "Crateria",
          "subarea": "Central",
          "id": 306
        }
      }
    ]
  },
  {
    "area": "Crateria",
    "subarea": "Central",
    "id": 13,
    "connections": [
      {
        "id": 1,
        "to": {
          "area": "Crateria",
          "subarea": "Central",
          "id": 10
        }
      },
      {
        "id": 2,
        "to": {
          "area": "Crateria",
          "subarea": "Central",
          "id": 19
        }
      }
    ]
  },
  {
    "area": "Crateria",
    "subarea": "Central",
    "id": 14,
    "connections": [
      {
        "id": 1,
        "to": {
          "area": "Crateria",
          "subarea": "Central",
          "id": 10
        }
      },
      {
        "id": 2,
        "to": {
          "area": "Crateria",
          "subarea": "Central",
          "id": 15
        }
      }
    ]
  },
  {
    "area": "Crateria",
    "subarea": "Central",
    "id": 15,
    "connections": [
      {
        "id": 1,
        "to": {
          "area": "Crateria",
          "subarea": "Central",
          "id": 14
        }
      }
    ]
  },
  {
    "area": "Crateria",
    "subarea": "Central",
    "id": 16,
    "connections": [
      {
        "id": 1,
        "to": {
          "area": "Crateria",
          "subarea": "Central",
          "id": 10
        }
      }
    ]
  },
  {
    "area": "Crateria",
    "subarea": "Central",
    "id": 17,
    "connections": [
      {
        "id": 1,
        "to": {
          "area": "Crateria",
          "subarea": "Central",
          "id": 18
        }
      }
    ]
  },
  {
    "area": "Crateria",
    "subarea": "Central",
    "id": 18,
    "connections": [
      {
        "id": 1,
        "to": {
          "area": "Crateria",
          "subarea": "Central",
          "id": 17
        }
      },
      {
        "id": 2,
        "to": {
          "area": "Crateria",
          "subarea": "Central",
          "id": 10
        }
      }
    ]
  },
  {
    "area": "Crateria",
    "subarea": "Central",
    "id": 19,
    "connections": [
      {
        "id": 1,
        "to": {
          "area": "Crateria",
          "subarea": "Central",
          "id": 13
        }
      }
    ]
  },
  {
    "area": "Crateria",
    "subarea": "Central",
    "id": 28,
    "connections": [
      {
        "id": 1,
        "to": {
          "area": "Crateria",
          "subarea": "Central",
          "id": 8
        }
      }
    ]
  },
  {
    "area": "Crateria",
    "subarea": "Central",
    "id": 29,
    "connections": [
      {
        "id": 1,
        "to": {
          "area": "Crateria",
          "subarea": "Central",
          "id": 11
        }
      },
      {
        "id": 2,
        "to": {
          "area": "Crateria",
          "subarea": "Central",
          "id": 11
        }
      }
    ]
  }
]
