[
    {
      "area": "Wrecked Ship",
      "subarea": "Main",
      "id": 154,
      "connections": [
        {
          "id": 1,
          "to": {
            "area": "Crateria",
            "subarea": "East",
            "id": 32
          }
        },
        {
          "id": 2,
          "to": {
            "area": "Wrecked Ship",
            "subarea": "Main",
            "id": 155
          }
        }
      ]
    },
    {
      "area": "Wrecked Ship",
      "subarea": "Main",
      "id": 155,
      "connections": [
        {
          "id": 1,
          "to": {
            "area": "Wrecked Ship",
            "subarea": "Main",
            "id": 154
          }
        },
        {
          "id": 2,
          "to": {
            "area": "Wrecked Ship",
            "subarea": "Main",
            "id": 159
          }
        },
        {
          "id": 3,
          "to": {
            "area": "Wrecked Ship",
            "subarea": "Main",
            "id": 156
          }
        },
        {
          "id": 4,
          "to": {
            "area": "Wrecked Ship",
            "subarea": "Main",
            "id": 163
          }
        },
        {
          "id": 5,
          "to": {
            "area": "Wrecked Ship",
            "subarea": "Main",
            "id": 164
          }
        },
        {
          "id": 6,
          "to": {
            "area": "Wrecked Ship",
            "subarea": "Main",
            "id": 304
          }
        },
        {
          "id": 7,
          "to": {
            "area": "Wrecked Ship",
            "subarea": "Main",
            "id": 160
          }
        }
      ]
    },
    {
      "area": "Wrecked Ship",
      "subarea": "Main",
      "id": 156,
      "connections": [
        {
          "id": 1,
          "to": {
            "area": "Wrecked Ship",
            "subarea": "Main",
            "id": 157
          }
        },
        {
          "id": 2,
          "to": {
            "area": "Wrecked Ship",
            "subarea": "Main",
            "id": 158
          }
        },
        {
          "id": 3,
          "to": {
            "area": "Wrecked Ship",
            "subarea": "Main",
            "id": 155
          }
        }
      ]
    },
    {
      "area": "Wrecked Ship",
      "subarea": "Main",
      "id": 157,
      "connections": [
        {
          "id": 1,
          "to": {
            "area": "Wrecked Ship",
            "subarea": "Main",
            "id": 156
          }
        }
      ]
    },
    {
      "area": "Wrecked Ship",
      "subarea": "Main",
      "id": 158,
      "connections": [
        {
          "id": 1,
          "to": {
            "area": "Wrecked Ship",
            "subarea": "Main",
            "id": 156
          }
        }
      ]
    },
    {
      "area": "Wrecked Ship",
      "subarea": "Main",
      "id": 159,
      "connections": [
        {
          "id": 1,
          "to": {
            "area": "Wrecked Ship",
            "subarea": "Main",
            "id": 155
          }
        }
      ]
    },
    {
      "area": "Wrecked Ship",
      "subarea": "Main",
      "id": 160,
      "connections": [
        {
          "id": 1,
          "to": {
            "area": "Crateria",
            "subarea": "East",
            "id": 32
          }
        },
        {
          "id": 2,
          "to": {
            "area": "Wrecked Ship",
            "subarea": "Main",
            "id": 155
          }
        },
        {
          "id": 3,
          "to": {
            "area": "Wrecked Ship",
            "subarea": "Main",
            "id": 168
          }
        }
      ]
    },
    {
      "area": "Wrecked Ship",
      "subarea": "Main",
      "id": 161,
      "connections": [
        {
          "id": 1,
          "to": {
            "area": "Crateria",
            "subarea": "East",
            "id": 32
          }
        },
        {
          "id": 2,
          "to": {
            "area": "Crateria",
            "subarea": "East",
            "id": 32
          }
        },
        {
          "id": 3,
          "to": {
            "area": "Wrecked Ship",
            "subarea": "Main",
            "id": 162
          }
        }
      ]
    },
    {
      "area": "Wrecked Ship",
      "subarea": "Main",
      "id": 162,
      "connections": [
        {
          "id": 1,
          "to": {
            "area": "Crateria",
            "subarea": "East",
            "id": 32
          }
        },
        {
          "id": 2,
          "to": {
            "area": "Wrecked Ship",
            "subarea": "Main",
            "id": 161
          }
        }
      ]
    },
    {
      "area": "Wrecked Ship",
      "subarea": "Main",
      "id": 163,
      "connections": [
        {
          "id": 1,
          "to": {
            "area": "Wrecked Ship",
            "subarea": "Main",
            "id": 155
          }
        }
      ]
    },
    {
      "area": "Wrecked Ship",
      "subarea": "Main",
      "id": 164,
      "connections": [
        {
          "id": 1,
          "to": {
            "area": "Wrecked Ship",
            "subarea": "Main",
            "id": 155
          }
        },
        {
          "id": 2,
          "to": {
            "area": "Wrecked Ship",
            "subarea": "Main",
            "id": 165
          }
        }
      ]
    },
    {
      "area": "Wrecked Ship",
      "subarea": "Main",
      "id": 165,
      "connections": [
        {
          "id": 1,
          "to": {
            "area": "Wrecked Ship",
            "subarea": "Main",
            "id": 164
          }
        },
        {
          "id": 2,
          "to": {
            "area": "Wrecked Ship",
            "subarea": "Main",
            "id": 166
          }
        }
      ]
    },
    {
      "area": "Wrecked Ship",
      "subarea": "Main",
      "id": 166,
      "connections": [
        {
          "id": 1,
          "to": {
            "area": "Wrecked Ship",
            "subarea": "Main",
            "id": 167
          }
        },
        {
          "id": 2,
          "to": {
            "area": "Wrecked Ship",
            "subarea": "Main",
            "id": 165
          }
        },
        {
          "id": 3,
          "to": {
            "area": "Crateria",
            "subarea": "East",
            "id": 34
          }
        }
      ]
    },
    {
      "area": "Wrecked Ship",
      "subarea": "Main",
      "id": 167,
      "connections": [
        {
          "id": 1,
          "to": {
            "area": "Wrecked Ship",
            "subarea": "Main",
            "id": 166
          }
        }
      ]
    },
    {
      "area": "Wrecked Ship",
      "subarea": "Main",
      "id": 168,
      "connections": [
        {
          "id": 1,
          "to": {
            "area": "Wrecked Ship",
            "subarea": "Main",
            "id": 160
          }
        }
      ]
    },
    {
      "area": "Wrecked Ship",
      "subarea": "Main",
      "id": 304,
      "connections": [
        {
          "id": 1,
          "to": {
            "area": "Wrecked Ship",
            "subarea": "Main",
            "id": 155
          }
        }
      ]
    }
  ]